{"$defs":{"artifactReference":{"additionalProperties":false,"properties":{"coordinate":{"minLength":1,"type":"string"},"digest":{"$ref":"#/$defs/digest"}},"required":["coordinate","digest"],"type":"object"},"digest":{"pattern":"^sha256:[0-9a-f]{64}$","type":"string"},"law":{"additionalProperties":false,"properties":{"canonicalDigest":{"$ref":"#/$defs/digest"},"lawIr":{"additionalProperties":true,"properties":{"apiVersion":{"const":"wesley.law-ir/v1"}},"required":["apiVersion"],"type":"object"},"semanticDigest":{"$ref":"#/$defs/digest"}},"required":["lawIr","semanticDigest","canonicalDigest"],"type":"object"},"operation":{"type":"object"},"shapeIr":{"additionalProperties":false,"properties":{"types":{"items":{"type":"object"},"type":"array"},"version":{"minLength":1,"type":"string"}},"required":["version","types"],"type":"object"}},"$id":"https://wesley.dev/schemas/wesley-extension-generation-input-v1.schema.json","$schema":"https://json-schema.org/draft/2020-12/schema","additionalProperties":false,"properties":{"apiVersion":{"const":"wesley.extension-generation-input/v1"},"law":{"$ref":"#/$defs/law"},"operations":{"items":{"$ref":"#/$defs/operation"},"type":"array"},"ownerDeclarations":{"items":{"$ref":"#/$defs/artifactReference"},"type":"array"},"projectionRoles":{"items":{"minLength":1,"type":"string"},"type":"array","uniqueItems":true},"settingsDigest":{"$ref":"#/$defs/digest"},"shapeDigest":{"$ref":"#/$defs/digest"},"shapeIr":{"$ref":"#/$defs/shapeIr"}},"required":["apiVersion","shapeIr","shapeDigest","operations","ownerDeclarations","settingsDigest","projectionRoles"],"title":"Wesley Extension Generation Input v1","type":"object"}
