{"apiVersion":"wesley.extension-generation-input/v1","operations":[{"arguments":[{"directives":{},"name":"id","type":{"base":"ID","isList":false,"nullable":false}}],"directives":{},"fieldName":"projection","operationType":"QUERY","resultType":{"base":"Projection","isList":false,"nullable":false},"rootTypeName":"Query"}],"ownerDeclarations":[{"coordinate":"fixture:semantic-source@1","digest":"sha256:90b878cbd69d5eb0c1673e4ed9652da70d97ff0a6ffbe689a4ec82241a5927ac"}],"projectionRoles":["generated-profile"],"settingsDigest":"sha256:e4a9ccba950218de669ddbf657479be7f173cd1806fddf8df434b1c4b402ed7c","shapeDigest":"sha256:88f778a53dfca78fe602b9e0b174c020d844700deb346d410b4fda29e374374f","shapeIr":{"types":[{"directives":{},"fields":[{"directives":{},"name":"coordinate","type":{"base":"ID","isList":false,"nullable":false}},{"directives":{},"name":"digest","type":{"base":"String","isList":false,"nullable":false}}],"kind":"OBJECT","name":"Projection"},{"directives":{},"fields":[{"arguments":[{"directives":{},"name":"id","type":{"base":"ID","isList":false,"nullable":false}}],"directives":{},"name":"projection","type":{"base":"Projection","isList":false,"nullable":false}}],"kind":"OBJECT","name":"Query"}],"version":"1.0.0"}}
